Person_272,Event0606,"Nicolini, Simon","Nicolini, Simon appraisal",appraisal,"1599 Vincenzo Gradenigo: 'Simon de' Piero, nato et allevato in sofia, ma p[er habitatione di qualche anno in Ragusi, et p[er esser ancò stato Dragomano di Ragusi d.o Raguseo huomo da bene, et di molto valore in questo essercitio, et che tratta con ogni vantaggio con grandi, et atto à ben intendere le nuove occorrenti, si come della sua persona ne ha essa havuto relatione, p.ma che io qui venissi, ho stimato gran servitio di lei il continuar di trattenirlo qui in casa, con tutto ch'egli fosse rissoluto di partire co'll Ill.mo Capello'",,1599,,,,,,,,,
Person_272,Event0607,"Nicolini, Simon","Nicolini, Simon appraisal",appraisal,"bailo Contarini: served 'più con le orecchie che con la lingua... ud""a volontieri solo le cose che si confacevano à suoi poco savj pensieri' [quoted in Barozzi-Berchet: 250-251. see also story @ Nicolini's scam involving Ottoman jeweler and the Bailo [in Coco & Manzonetto 1985: 115, note 14
",,,,,,,,,,,
Person_273,Event0608,"Nores, Giacomo de","Nores, Giacomo de Birth",Birth,Birth,1904-04-17,,,,,,Cyprus,,,,
Person_273,Event0609,"Nores, Giacomo de","Nores, Giacomo de Death",Death,,1904-06-14,,,,,,,,,,post
Person_273,Event0610,"Nores, Giacomo de","Nores, Giacomo de employment end",employment end,,1904-06-14,1627,,,,,,,,,
Person_273,Event0611,"Nores, Giacomo de","Nores, Giacomo de travel",travel,"1581: still in Ottoman captivity, traveled with his master to the Safavid frontier, where in all probability he learned some Persian",,1581,,,,,,,,,
Person_273,Event0612,"Nores, Giacomo de","Nores, Giacomo de travel",travel,1587: arrived in Venice,,1587,,,,,,,,,
Person_273,Event0613,"Nores, Giacomo de","Nores, Giacomo de employment",employment,1594: employed by Board of Trade,,1594,,,,,,,,,
Person_273,Event0614,"Nores, Giacomo de","Nores, Giacomo de salary",salary,1618: 800 ducats a year,,1618,,,,,,,,,
Person_275,Event0615,"Olivieri, Antonio","Olivieri, Antonio Birth",Birth,Birth,,,,,,,Istanbul,,,,
Person_275,Event0616,"Olivieri, Antonio","Olivieri, Antonio employment end",employment end,,1904-07-27,post1670,,,,,,,,,
Person_275,Event0617,"Olivieri, Antonio","Olivieri, Antonio ",,1670: 15 yrs old,,1670,,,,,,,,,
Person_275,Event0618,"Olivieri, Antonio","Olivieri, Antonio travel",travel,"1610: accompanies venetian merchants to the Morea [Ecnebi defteri, 13, #270, fol. 30",,1610,,,,,,,,,
Person_275,Event0619,"Olivieri, Antonio","Olivieri, Antonio appraisal",appraisal,"1670 special ambassador Alvise Molin: 'tiene il solo spirito e dispositione per imparare, ma di presente senza alcuna intelligenza.' [Archivio proprio Costantinopoli, b. 24, c. 324v (7/28/1670), quoted in Luca 2008: 156",,1670,,,,,,,,,
Person_278,Event0620,"Olivieri, Giovanni","Olivieri, Giovanni Birth",Birth,Birth,,,,,,,Istanbul,,,,
Person_278,Event0621,"Olivieri, Giovanni","Olivieri, Giovanni employment end",employment end,,1904-07-17,post1660,,,,,,,,,
Person_278,Event0622,"Olivieri, Giovanni","Olivieri, Giovanni Employment End",Employment End,,1904-07-17,post1660,,,,,,,,,
Person_278,Event0623,"Olivieri, Giovanni","Olivieri, Giovanni appointment",appointment,"9/25/1635: appointed Dragoman based on bailo's good appraisal of his progress in studies as gdl, same salary & benefits as other dragomans",1635-09-25,,,,,,,,,,
Person_278,Event0624,"Olivieri, Giovanni","Olivieri, Giovanni salary",salary,1641: annual salary of 118 zecchini,,1641,,,,,,,,,
Person_278,Event0625,"Olivieri, Giovanni","Olivieri, Giovanni salary",salary,1654: annual salary 130 zecchini,,1654,,,,,,,,,
Person_278,Event0626,"Olivieri, Giovanni","Olivieri, Giovanni appraisal",appraisal,"1641: 'L'Olivieri è giovane senza pelo di Barba, e con poca disposit.ne à farla, che qui non è poco contrario; Vogliono ch' egli parli il Turco, l'Arabo, et il Persiano delli quali linguaggi è composta la Turca, più elegantem.te d'ogn'altro; nell'Italiano veram.te non hà lui la miglior espresione del mondo, e huomo di modestia, e di buon termine.'",,1641,,,,,,,,,
Person_281,Event0627,"Pace, Girolamo","Pace, Girolamo Birth",Birth,Birth,,,,,,,Split,,,,
Person_281,Event0628,"Pace, Girolamo","Pace, Girolamo employment end",employment end,,1904-06-16,post1629,,,,,,,,,
Person_281,Event0629,"Pace, Girolamo","Pace, Girolamo Employment End",Employment End,,1904-06-16,post1629,,,,,,,,,
Person_281,Event0630,"Pace, Girolamo","Pace, Girolamo appointment; salary",appointment; salary,"approved as dragoman della lingua turca in Spalato, salary of 6 ducats a month",,,,,,,,,,,
Person_282,Event0631,"Pace, Marco","Pace, Marco Birth",Birth,Birth,,,,,,,Split,,,,
Person_282,Event0632,"Pace, Marco","Pace, Marco salary",salary,"1641: annual salary of 60 ducats, 6 zecchini, 2 outfits",,1641,,,,,,,,,
Person_282,Event0633,"Pace, Marco","Pace, Marco appraisal",appraisal,"1641: 'lasciar il Giovine della lingua Pace, condotto meco con licenza dell'Ecc.mo Sen.o quale anco intendo, à misura di suoi talenti, & età, essersi portato bene; Et è di p'nte in Provincia per supplicar V'ra Ser del solito accrescim.to, et ritornar à Const.li à perfettionar li suoi studij'",,1641,,,,,,,,,
Person_283,Event0634,"Paleologo, Todaro [Teodoro","Paleologo, Todaro [Teodoro Birth",Birth,Birth,,,,,,,Famagosta/Zante,,,,date questionable
Person_283,Event0635,"Paleologo, Todaro [Teodoro","Paleologo, Todaro [Teodoro employment end",employment end,,1904-03-12,1533,,,,,,,,,
Person_283,Event0636,"Paleologo, Todaro [Teodoro","Paleologo, Todaro [Teodoro Employment End",Employment End,,1904-03-12,1533,,,,,,,,,
Person_283,Event0637,"Paleologo, Todaro [Teodoro","Paleologo, Todaro [Teodoro employment",employment,"mentioned in letter by 'oratori nostri vanno al Signor turcho' written in Famagosta on 7/14/1517; translator of Ahd-Name of 1517 [Theunissen 1999: 10; Papadia-Lala 2009: was a capo stratioti, member of the Greek confraternity in Venice, hailed from Zante, worked for the Doge's segreteria. see numerous references in Sanuto; mentioned in Sanuto's summary of Mocenigo's relazione of 1518 (Alberi III.III: 53) and in that of Bartolomeo Contarini of 1519 (Alberi III.III: 58, 68) and that of Marco Minio of 1527 (III.III: 117) as ambassador's turciman (1)/interprete (2 + 3) in divan.",1517-07-14,,,,,,,,,,
Person_284,Event0638,"Parada, Ippolito","Parada, Ippolito employment end",employment end,,1904-06-24,1637,,,,,,,,,
Person_284,Event0639,"Parada, Ippolito","Parada, Ippolito travel; petition",travel; petition,viaggio in Algeri by order of Bailo Capello to recover stuff of Amb.r Cornaro in Spagna. still waitg to receive 162 D in recompense.,,,,,,,,,,,
Person_285,Event0640,"Parada, Michiel","Parada, Michiel Birth",Birth,Birth,,,,,,,Istanbul,,,,
Person_285,Event0641,"Parada, Michiel","Parada, Michiel Employment End",Employment End,,1904-07-27,1670,,,,,,,,,
Person_285,Event0642,"Parada, Michiel","Parada, Michiel employment",employment,1641: gdl,,1641,,,,,,,,,
Person_285,Event0643,"Parada, Michiel","Parada, Michiel travel",travel,1658: carried Ottoman proposals in matter of Candia from Istanbul to Venice [Brusoni 1673: 48,,2658,,,,,,,,,
Person_285,Event0644,"Parada, Michiel","Parada, Michiel election",election,1670: elected prior of Magnifica Comunita,,1670,,,,,,,,,
Person_286,Event0645,"Perone, Giovanni","Perone, Giovanni Birth",Birth,Birth,,,,,,,Istanbul,,,,
Person_286,Event0646,"Perone, Giovanni","Perone, Giovanni employment end",employment end,,1904-07-21,post1664,,,,,,,,,
Person_286,Event0647,"Perone, Giovanni","Perone, Giovanni Employment End",Employment End,,1904-07-21,post1664,,,,,,,,,
Person_286,Event0648,"Perone, Giovanni","Perone, Giovanni employment",employment,1646: still Gdl,,1646,,,,,,,,,
Person_286,Event0649,"Perone, Giovanni","Perone, Giovanni petition",petition,"1655: supplica atttached to Ballarino's letter (542r-546v), askg to receive title of dragoman after 20 yrs of service as gdl. Ballarino in favor",,1655,,,,,,,,,
Person_286,Event0650,"Perone, Giovanni","Perone, Giovanni election",election,1651: elected sub-prior of Magnifica Comunita,,1651,,,,,,,,,
Person_286,Event0651,"Perone, Giovanni","Perone, Giovanni appraisal",appraisal,"1641: 'nativo di Pera, e fra li Gentilhuomeni di Rito lattino, che sono in quel luoco, benche di p'nte il di lui Padre caduto in povertà di molti debiti aggravato li ritrovi.'
Ballarino, 1655: Egli si trova avvanzato negli anni. è di buona nascita. Hà patito prigionie et infirmità nelli studi, delle lingue è impossessato. Il n.ro dei dragomani è ristretto. sono molti anni ch'egli s'impiegi co'l carattere di Giovane di lingua s'è trattenuto qui dentro tutto il tempo della p'nte prigionia. Hà servito in tutto il Bailaggio dell'Ecc.mo S.r Cav.r Soranzo, dal q.al fù spedito in Candia p[er pub.e occorenze; ch'è q.to posso rapp'ntar sopra la scritt.a med.ma.'
",,1641,,,,,,,,,
Person_292,Event0652,"Pizzari, Michiel","Pizzari, Michiel Birth",Birth,Birth,,,,,,,Crete,,,,
Person_292,Event0653,"Pizzari, Michiel","Pizzari, Michiel employment end",employment end,,1642-11-06,post1642-11-06,,,,,,,,,
Person_292,Event0654,"Pizzari, Michiel","Pizzari, Michiel appraisal",appraisal,learned Turkish & Lingua Mora [Arabic? to mk h/s more fit for pub service. ,,,,,,,,,,,
Person_292,Event0655,"Pizzari, Michiel","Pizzari, Michiel travel",travel,"1640: was sent by then Prv.re G'nal & Inquisitor el regno di Candia Iseppo Civran to Bailo in Istanbul. En route was enslaved by Corsairs, robbed of his belonggs. contd voyage nonetheless.",,1640,,,,,,,,,
Person_292,Event0656,"Pizzari, Michiel","Pizzari, Michiel appointment",appointment,"apptd 10/26/1640 by Marin Bragadin, Cap.o Grande di Candia, as Dragomano Publico in place of deceased Manoli Armandani. asks that appt be confirmed by gvt",1640-10-26,,,,,,,,,,
Person_293,Event0657,Pizzoni,Pizzoni Birth,Birth,Birth,,,,,,,Venice,,,,
Person_293,Event0658,Pizzoni,Pizzoni appraisal,appraisal,"new bailo Marino Cavalli applauds 'che ha fatto buon frutto nel parlare, nel scrivere et nel leggere non solo nella lingua turca ma nell'araba ancora'",,,,,,,,,,,
Person_296,Event0659,"Priuli, Andrea","Priuli, Andrea Commission",Commission,commission,1522-03-31,,,,,,,,,,"Archivio di Stato di Venezia, SS, reg. 49, cc. 73v-74v."
Person_297,Event0660,"Quartano, Nicolò","Quartano, Nicolò Birth",Birth,Birth,,,,,,,Corfu,,,,
Person_297,Event0661,"Quartano, Nicolò","Quartano, Nicolò employment end",employment end,,1904-05-06,post1588,,,,,,,,,date inferred
Person_297,Event0662,"Quartano, Nicolò","Quartano, Nicolò Employment End",Employment End,,1904-05-06,post1588,,,,,,,,,date inferred
Person_297,Event0663,"Quartano, Nicolò","Quartano, Nicolò ",,"accusato di omicidio, fu interprete al servizio del sultano; la sua presenza viene segnalata, ad intervalli più o meno regolatri, a Corfù, a Costantinopoli ed in Francia.' Papadia-Lala 2009",,,,,,,,,,,
Person_298,Event0664,"Querini, Francesco","Querini, Francesco Commission",Commission,,1390-03-06,6 March 1390,,,,,,,,,"Archivio di Stato di Venezia, SM, reg. 41, cc. 59-60; Iorga, Venetia, pp. 1102-1103; Thiriet, Sénat, I, n. 768."
Person_299,Event0665,"Querini, Giacomo","Querini, Giacomo Commission",Commission,,,20 giugno 1671,,,,,,,,,"Archivio di Stato di Venezia, SC, reg. 32, cc. 152v-159."
Person_299,Event0666,"Querini, Giacomo","Querini, Giacomo election",election,election,,20 giugno 1671,,,,,,,,,"Archivio di Stato di Venezia, SC, reg. 32, cc. 152v-159."
Person_302,Event0667,"Ragazzoni, Jacopo","Ragazzoni, Jacopo Commission",Commission,commission,1571-03-08,8 March 1571,,,,,,,,,"Archivio di Stato di Venezia, SC, reg. 4, cc. 27-28."
Person_302,Event0668,"Ragazzoni, Jacopo","Ragazzoni, Jacopo ",,,,15 novembre 1555,,,,,,,,,"Archivio di Stato di Venezia, SS, reg. 69, cc. 157-160."
Person_303,Event0669,"Renier, Alvise","Renier, Alvise Commission",Commission,,,5 July 1547,,,,,,,,,"Archivio di Stato di Venezia, SS, reg. 65, cc. 126v-131."
Person_303,Event0670,"Renier, Alvise","Renier, Alvise election",election,election,1555-08-28,,,,,,,,,,"Archivio di Stato di Venezia, SAVP, reg. 2, c. 34a; SAVP, reg. B, c. 84v; SS , reg. 69, c. 138v. "
Person_303,Event0671,"Renier, Alvise","Renier, Alvise Commission",Commission,commission,1547-07-05,,,,,,,,,,"Archivio di Stato di Venezia, SS, reg. 65, cc. 126v-131."
Person_303,Event0672,"Renier, Alvise","Renier, Alvise Commission",Commission,commission,,15 novembre 1555,,,,,,,,,"Archivio di Stato di Venezia, SS, reg. 69, cc. 157-160."
Person_303,Event0673,"Renier, Alvise","Renier, Alvise election",election,Ambasciatore per congratularsi con il sultano per le vittorie in Persia.,,25 agosto 1555,,,,,,,,,"Archivio di Stato di Venezia, SAVP, reg. 2, c. 34a; SAVP, reg. B, c. 84v; SS , reg. 69, c. 138v. "
Person_304,Event0674,"Renier, Paolo","Renier, Paolo accreditation",accreditation, credenziali come ambasciatore,,7 maggio 1774,,,,,,,,,"Archivio di Stato di Venezia, SC, reg. 52, a. 1771, cc. 4v-10."
Person_304,Event0675,"Renier, Paolo","Renier, Paolo Commission",Commission,commission,1771-03-14,,,,,,,,,,"Archivio di Stato di Venezia, SC, reg. 53, a. 1774, cc. 21-24."
Person_306,Event0676,"Ruzzini, Carlo","Ruzzini, Carlo Commission",Commission,commission,1705-07-16,16 July 1705,,,,,,,,,"Archivio di Stato di Venezia, SC, reg. 36, cc. 178-181."
Person_307,Event0677,"Ruzzini, Carlo","Ruzzini, Carlo Commission",Commission,commission,1719-03-24,24 March 1719,,,,,,,,,"Archivio di Stato di Venezia, SC, reg. 38, cc. 5v-9."
Person_307,Event0678,"Ruzzini, Carlo","Ruzzini, Carlo ",,,,"30 May 1496, 3 January 1497",,,,,,,,,"Archivio di Stato di Venezia, SS, reg. 36, cc. 27-28v."
Person_308,Event0679,"Sagomala, Zuanne","Sagomala, Zuanne Birth",Birth,Birth,,,,,,,Napoli de romania,,,,
Person_309,Event0680,"Sagundino, Alvise","Sagundino, Alvise Commission; appointment",Commission; appointment,"Inviato, come segretario",,"30 May 1496, 3 January 1497",,,,,,,,,"Archivio di Stato di Venezia, SS, reg. 36, cc. 27-28v."
Person_309,Event0681,"Sagundino, Alvise","Sagundino, Alvise Commission",Commission,commission,1497-01-03,,,,,,,,,,"Archivio di Stato di Venezia, SS, reg. 36, cc. 99v-100."
Person_310,Event0682,"Sagundino, Nicolò","Sagundino, Nicolò Commission",Commission,,,2 March 1461,,,,,,,,,"Archivio di Stato di Venezia, SS, reg. 21, cc. 34-35."
Person_310,Event0683,"Sagundino, Nicolò","Sagundino, Nicolò Commission",Commission,commission,1461-03-02,,,,,,,,,,"Archivio di Stato di Venezia, SS, reg. 21, cc. 34-35."
Person_312,Event0684,"Salvago, Gianesin (I)","Salvago, Gianesin (I) Birth",Birth,Birth,,,,,,,Istanbul,,,,
Person_312,Event0685,"Salvago, Gianesin (I)","Salvago, Gianesin (I) employment end",employment end,,1904-04-09,1561,,,,,,,,,date approximate
Person_312,Event0686,"Salvago, Gianesin (I)","Salvago, Gianesin (I) Employment End",Employment End,,1904-04-09,1561,,,,,,,,,date approximate
Person_312,Event0687,"Salvago, Gianesin (I)","Salvago, Gianesin (I) bonus",bonus,before 1553 received from gvt twice 400 ducats for daughters' dowries. Had 4 daughters.,,before 1553,,,,,,,,,
Person_312,Event0688,"Salvago, Gianesin (I)","Salvago, Gianesin (I) appraisal",appraisal,"1560: Marino Cavalli accuses him of 'bestialità; vanità, e poca fede,' endangering relations with Ottomans",,1560,,,,,,,,,
Person_313,Event0689,"Salvago, Gianesin (II)","Salvago, Gianesin (II) Birth",Birth,Birth,,,,,,,Istanbul,,,,
Person_313,Event0690,"Salvago, Gianesin (II)","Salvago, Gianesin (II) employment end",employment end,,1904-06-05,1618,,,,,,,,,
Person_313,Event0691,"Salvago, Gianesin (II)","Salvago, Gianesin (II) Employment End",Employment End,,1904-06-05,1618,,,,,,,,,
Person_313,Event0692,"Salvago, Gianesin (II)","Salvago, Gianesin (II) appraisal",appraisal,"1585: mentioned by bailo Gianfrancesco Morosini (1585: 319-20): 'Dal quale Zanettino, nel tempo del mio bailaggio, ho ricevuto grandissimo servizio, avendolo tenuto di continuo in casa mia, che mi ha giovato assai per poter trattar con molti Turchi che mi venivano a ritrovare; perchè, non stando in casa gli altri, con più difficoltà mi sarebbe molte volte convenuto mandar cercando qua e là dragomani, se questo con la continua assistenza non m'avesse ajutato; però io lo raccomando alla Serenità Vostra.'",,1585,,,,,,,,,
Person_313,Event0693,"Salvago, Gianesin (II)","Salvago, Gianesin (II) dismissal",dismissal,1588: thrown out of bailo's house for love affair with the barbar,,1588,,,,,,,,,
Person_313,Event0694,"Salvago, Gianesin (II)","Salvago, Gianesin (II) employment",employment,before 1599: reemployed,,before 1599,,,,,,,,,
Person_313,Event0695,"Salvago, Gianesin (II)","Salvago, Gianesin (II) employment; raise",employment; raise,1604: has served for 23 yrs already; raise,,1604,,,,,,,,,
Person_313,Event0696,"Salvago, Gianesin (II)","Salvago, Gianesin (II) employment; raise",employment; raise,"1607: 27 years of service, another raise (from 200 to 250 cecchini annually)",,1607,,,,,,,,,
Person_313,Event0697,"Salvago, Gianesin (II)","Salvago, Gianesin (II) travel",travel,"1611: Ottoman permission to accompany new bailo Cristoforo Venier en route from Venice to Istanbul [Ecnebi Defterleri 13, fol. 39, #378-9",,1611,,,,,,,,,
Person_313,Event0698,"Salvago, Gianesin (II)","Salvago, Gianesin (II) travel",travel,"6/7/1614: Ottoman permission to accompany new bailo [Almoro Nani en route from Venice to Istanbul [Ecnebi Defterleri 13, fol. 56, #564",1614-06-07,,,,,,,,,,
Person_313,Event0699,"Salvago, Gianesin (II)","Salvago, Gianesin (II) salary",salary,"1618: in Venice to accompany ambassador, receives annual salary of 100 cecchini",,,,,,,,,,,
Person_314,Event0700,"Salvago, Gio: Battista","Salvago, Gio: Battista Birth",Birth,Birth,1904-05-05,,,,,,Istanbul,,,,
Person_314,Event0701,"Salvago, Gio: Battista","Salvago, Gio: Battista employment end",employment end,,1904-07-01,1644,,,,,,,,,
Person_314,Event0702,"Salvago, Gio: Battista","Salvago, Gio: Battista Employment End",Employment End,,1904-07-01,1644,,,,,,,,,
Person_314,Event0703,"Salvago, Gio: Battista","Salvago, Gio: Battista education",education,spent 5 years from ca. 1602 to 1607 in a seminary in Venice to learn Italian and Latin,,ca. 1602,,,1607,,,,,,
Person_314,Event0704,"Salvago, Gio: Battista","Salvago, Gio: Battista appraisal",appraisal,"1634: Gli impieghi fruttuosi del fed.mo Gio.e Batt'a Salvago Dragomano, meritano molto bene ogni segno di stima, e d'honore, havendo servito lunghi anni, cosi in Costantinopoli, come fuori in occasioni di accompagnar Baili, Ambasc.ri, et in altri dificili viaggi, et impieghi, nei quali senza riguardo ne pericoli hà sempre con ogni termine di devotione, et honore pronta, et fruttuosam.te prestata l'opera sua ad imitatione de suoi benemeriti Antenati, et di dua suoi fra'lli im particolare, che pur nel med.mo posto di Dragomani havendo adempito al magg.re segno il loro debito nei servitij della s.a N.a han lasciata la vita; Aggiungendosi q. tanto ancora li degni, e pieni attestati, che fanno li Baili nostri delle non ordinare conditioni di questo soggetto, deve concorrer la publica munificenza à progerle qualche segno di commodo, e di sollievo; Però, l'anderà parte, che al sud.to fed.mo Gio: Batt'a Slavago Dragomano siano concessi d'augumento cecchini dieci al mese, che gli doveranno esser corrisposti dal Bailo nostro per il tempo che si trattenirà in Costantinopoli, e cessarle quando sarà impiegato nei viaggi nell'accompagnar Baili, Ambasc.ri nostri, l'obligatione di che (come Dragoman di strada deputato) gli debba restare sempre adossata, ne possi sottrarsene alle occasioni, che nacessero. ",,1634,,,,,,,,,
Person_314,Event0705,"Salvago, Gio: Battista","Salvago, Gio: Battista appraisal",appraisal,"1641: 'molto ben conosciuto dall'Ecc.ze VV frequentando questo il viaggio di Venetia nel venir à levare, e ricondur di ritorno li Baili. questo è dragoman da strada; hà fatto, e fà il su Ministerio mirabilm.te bene; nel tradur' una scritt.a turca p[er voce d'ogn'uno non ciede ad alcuno; è già di età di 54 anni in c.a assai grave della p[ersona, et p[er me credo che non potrà lungam.te sofferire li pattim.ti di cosi lunghi, e difficili viaggi...'",,1641,,,,,,,,,
Person_314,Event0706,"Salvago, Gio: Battista","Salvago, Gio: Battista appraisal",appraisal,"1626: renegotiated border w Ottomans in Dalmatia [see Mayhew 2008: 160 1634: Gli impieghi fruttuosi del fed.mo Gio.e Batt'a Salvago Dragomano, meritano molto bene ogni segno di stima, e d'honore, havendo servito lunghi anni, cosi in Costantinopoli, come fuori in occasioni di accompagnar Baili, Ambasc.ri, et in altri dificili viaggi, et impieghi, nei quali senza riguardo ne pericoli hà sempre con ogni termine di devotione, et honore pronta, et fruttuosam.te prestata l'opera sua ad imitatione de suoi benemeriti Antenati, et di dua suoi fra'lli im particolare, che pur nel med.mo posto di Dragomani havendo adempito al magg.re segno il loro debito nei servitij della s.a N.a han lasciata la vita; Aggiungendosi q. tanto ancora li degni, e pieni attestati, che fanno li Baili nostri delle non ordinare conditioni di questo soggetto, deve concorrer la publica munificenza à progerle qualche segno di commodo, e di sollievo; Però, l'anderà parte, che al sud.to fed.mo Gio: Batt'a Slavago Dragomano siano concessi d'augumento cecchini dieci al mese, che gli doveranno esser corrisposti dal Bailo nostro per il tempo che si trattenirà in Costantinopoli, e cessarle quando sarà impiegato nei viaggi nell'accompagnar Baili, Ambasc.ri nostri, l'obligatione di che (come Dragoman di strada deputato) gli debba restare sempre adossata, ne possi sottrarsene alle occasioni, che nacessero. 1641: 'molto ben conosciuto dall'Ecc.ze VV frequentando questo il viaggio di Venetia nel venir à levare, e ricondur di ritorno li Baili. questo è dragoman da strada; hà fatto, e fà il su Ministerio mirabilm.te bene; nel tradur' una scritt.a turca p[er voce d'ogn'uno non ciede ad alcuno; è già di età di 54 anni in c.a assai grave della p[ersona, et p[er me credo che non potrà lungam.te sofferire li pattim.ti di cosi lunghi, e difficili viaggi...'",,1626,,,,,,,,,
Person_314,Event0707,"Salvago, Gio: Battista","Salvago, Gio: Battista appraisal",appraisal,"1612: 'è un giovine di buon ingegno e di molta bontà; s'affatica per apprendere quel linguaggio, ma ci dava in bestia sovra gli altri, per essersi applicato tardi; ha qualche lettera non pur umana, ma di filosofia ancora: vive con gran modestia, serve bene, e serve a' Baili in molte cose; insomma è buon soggetto'
",,1612,,,,,,,,,
Person_316,Event0708,"Salvago, Giuliano","Salvago, Giuliano Birth",Birth,Birth,,,,,,,Istanbul,,,,
Person_316,Event0709,"Salvago, Giuliano","Salvago, Giuliano employment end",employment end,,1904-05-29,1611,,,,,,,,,
Person_316,Event0710,"Salvago, Giuliano","Salvago, Giuliano Employment End",Employment End,,1904-05-29,1611,,,,,,,,,
Person_316,Event0711,"Salvago, Giuliano","Salvago, Giuliano employment; salary",employment; salary,"9/5/1605: hired in Aleppo, annual salary: 100 zecchini",1605-09-05,,,,,,,,,,
Person_316,Event0712,"Salvago, Giuliano","Salvago, Giuliano travel",travel,"8/19/1609 in Istanbul, heads for Aleppo",1609-08-19,,,,,,,,,,
Person_316,Event0713,"Salvago, Giuliano","Salvago, Giuliano litigation",litigation,"early Sept. 1609: belongings confiscated in Syria [Ecnebi defteri, 13, fol. 33, #309 ",,early Sept. 1609,,,,,,,,,
Person_316,Event0714,"Salvago, Giuliano","Salvago, Giuliano death",death,7/9/1611: died,1611-07-09,,,,,,,,,,
Person_317,Event0715,"Salvago, Mateca","Salvago, Mateca Birth",Birth,Birth,,,,,,,Istanbul,,,,
Person_317,Event0716,"Salvago, Mateca","Salvago, Mateca employment end",employment end,,1904-05-10,1592,,,,,,,,,
Person_317,Event0717,"Salvago, Mateca","Salvago, Mateca Employment End",Employment End,,1904-05-10,1592,,,,,,,,,
Person_317,Event0718,"Salvago, Mateca","Salvago, Mateca appraisal",appraisal,"Daniele Barbarigo 1564: 54: in mio tempo essendo il carico suo sopra li schiavi, è stato tanto diligente che più non si potria desiderare; ma pur ancor lui è stato d' accordo con li altri turcimani a perseguitar messer Pietro Maruffo nel garbuglio del giannizzero, come qui appresso si dirà.",,1564,,,,,,,,,
Person_317,Event0719,"Salvago, Mateca","Salvago, Mateca raise",raise,12/27/1566: asks for salary increase - granted,1566-12-27,,,,,,,,,,
Person_317,Event0720,"Salvago, Mateca","Salvago, Mateca travel",travel,"4/26/1571 in Ragusa accompanying Ragazzoni, seriously ill. left there. see Ragazonni's relazione",1571-04-26,,,,,,,,,,
Person_317,Event0721,"Salvago, Mateca","Salvago, Mateca dismissal",dismissal,"10/22/1574 CX orders bailo to dismiss him from service, take away his stipend [see Lamanskii 1968: 102, doc. LXVI = SCX reg. 11, c. 35",1574-10-22,,,,,,,,,,
Person_317,Event0722,"Salvago, Mateca","Salvago, Mateca appraisal",appraisal,"1592: Dragoman da strada, absentyism, conflict w relatives Gagliani over inheritance, very negative report by Lorenzo Bernardo, pp. 413-4",,1592,,,,,,,,,
Person_317,Event0723,"Salvago, Mateca","Salvago, Mateca appraisal",appraisal,"6/3/1592: CX order bailo to send him to Venice to be poisoned or alternatively dismissed from service [Lamansky 1884: 103-5, doc. LXVI = SCX, reg. 13, c. 95 & c. 114, 11/12/1593",1592-06-03,,,,,,,,,,
Person_317,Event0724,"Salvago, Mateca","Salvago, Mateca ",,"ca. 10/2/1593: tells ambassador Matteo Zane that when Zane's successor arrives in Pera he [Matteca intends to double the rent on the bailo's house, which is currently 100 sequins annually, + upkeep. translated/quoted in Calendar of State Papers Relating to English Affairs in the Archives of Venice, Volume 9 (1897), #222 ",1593-10-02,ca. 10/2/1593,,,,,,,,,
